{
  "$schema": "http://json-schema.org/draft-07/schema#",
  "$id": "https://daox.ssv.network/external-tool.schema.json",
  "title": "DAOx External Tool",
  "description": "A community-contributed external tool listed on the DAOx hub. One file per tool in data/external-tools/<id>.json. Keep this mirror in sync with lib/external-tool.schema.ts.",
  "type": "object",
  "additionalProperties": false,
  "required": ["id", "name", "description", "categories", "inputs", "outputs", "url"],
  "properties": {
    "$schema": {
      "type": "string",
      "description": "Path to this schema for editor autocomplete. Use \"../external-tool.schema.json\"."
    },
    "id": {
      "type": "string",
      "pattern": "^[a-z0-9]+(?:-[a-z0-9]+)*$",
      "description": "Unique lower-case kebab-case identifier, matching the filename (e.g. \"stake-easy\"). Never displayed."
    },
    "name": {
      "type": "string",
      "minLength": 1,
      "description": "Display name of the tool."
    },
    "description": {
      "type": "string",
      "minLength": 1,
      "description": "One or two sentences on what the tool does and for whom."
    },
    "categories": {
      "type": "array",
      "minItems": 1,
      "uniqueItems": true,
      "description": "One or more categories. Drives the filter and the auto-selected icon.",
      "items": {
        "type": "string",
        "enum": ["Simulator", "Calculator", "Dashboard", "Explorer", "Claim"]
      }
    },
    "inputs": {
      "type": "string",
      "minLength": 1,
      "description": "Short formula-style inputs, segments separated by \" · \" (e.g. \"ETH amount · Tier\")."
    },
    "outputs": {
      "type": "string",
      "minLength": 1,
      "description": "Short formula-style outputs, segments separated by \" · \" (e.g. \"SSV/yr · USD\")."
    },
    "url": {
      "type": "string",
      "format": "uri",
      "pattern": "^https?://",
      "description": "Absolute http(s) destination URL."
    },
    "host": {
      "type": "string",
      "minLength": 1,
      "description": "Optional display host (e.g. \"stakeeasy.xyz\"). Derived from the URL when omitted."
    },
    "featured": {
      "type": "boolean",
      "description": "Maintainer-only. Pins the tool to the top of the list with a \"Featured\" pill."
    },
    "sortOrder": {
      "type": "number",
      "description": "Optional ordering hint within the featured / non-featured group. Lower sorts first."
    }
  }
}
