{
  "$schema": "../external-tool.schema.json",
  "id": "ssv-eth-migration-forecast",
  "name": "ETH Migration Forecast",
  "description": "Informational estimator for the SSV mainnet migration — calculates the ETH a cluster owner needs to deposit to cover runway and collateral, using live cluster and operator data. No wallet connection or transactions.",
  "categories": ["Calculator", "Simulator"],
  "inputs": "Cluster address · Runway days",
  "outputs": "Required ETH · Breakdown",
  "url": "https://ssv-eth-forecasting.vercel.app"
}
